,hs-cTnI,D-dimer,NT-proBNP,CRP,Copeptin,H-FABP,Myoglobin,Procalcitonin
ACS (STEMI/NSTEMI/UA),Lipinski 2015 [4]; pooled hs-cTn for AMI,"Orak 2010, J Int Med Res 38(4):1428; D-dimer in ACS vs non-cardiac chest pain",No diagnostic accuracy data; not a viable stand-alone ACS biomarker,"Cui 2008, J Clin Lab Anal 22(1):45; CRP for ACS vs non-ischemic chest pain",Keller 2011 [6]; Raskovalova 2013 [8]; pooled for AMI,"Bruins Slot 2010, Heart 96(24):1957; pooled for AMI <6h",Lipinski 2015 [4]; pooled for AMI,Crawford 2019 [10]; minimal elevation in ACS
Pulmonary Embolism,"Becattini 2007, Circulation 116(4):427; troponin in PE",Geersing 2012 [5]; pooled for PE,"Klok 2008, Am J Respir Crit Care Med 178(4):425; RV strain marker","Abul 2011, J Invest Med 59(8):1268; CRP in PE","Hellenkamp 2015, Eur J Heart Fail 17(2):119","Puls 2007, Eur Heart J 28(2):224",No diagnostic accuracy data; not a viable PE biomarker,"Kokturk 2011, Clin Appl Thromb Hemost 17(5):E1; modest elevation in PE"
Aortic Dissection,"Vrsalovic 2016, Int J Cardiol 215:261; troponin meta-analysis in AoD",Nazerian 2018 [Circulation]; Sodeck 2007; pooled,No diagnostic accuracy data; not a viable aortic dissection biomarker,"Schillinger 2002, Intensive Care Med 28(9):1305; vascular inflammation","Morello 2018, Sci Rep 8:5137; copeptin stress response in AoD",No diagnostic accuracy data; not a viable aortic dissection biomarker,No diagnostic accuracy data; not a viable aortic dissection biomarker,No diagnostic accuracy data; not a viable aortic dissection biomarker
Pericarditis / Myocarditis,"Caforio 2013, Eur Heart J 34(33):2636; ESC myocarditis guidelines",No diagnostic accuracy data; not a viable pericarditis/myocarditis biomarker,"Caforio 2013, Eur Heart J 34(33):2636; myocardial wall stress",Imazio 2011 [Circulation]; CRP in acute pericarditis,No diagnostic accuracy data; not a viable pericarditis/myocarditis biomarker,"Cui 2025, Int Heart J 66(1):88; H-FABP in myocarditis","Kottwitz 2020, J Cardiovasc Transl Res 13:488; myoglobin for CMR-confirmed myocarditis",Crawford 2019 [10]; elevated if bacterial etiology
Pneumothorax (tension),No diagnostic accuracy data; not a viable pneumothorax biomarker,No diagnostic accuracy data; not a viable pneumothorax biomarker,No diagnostic accuracy data; not a viable pneumothorax biomarker,No diagnostic accuracy data; not a viable pneumothorax biomarker,No diagnostic accuracy data; not a viable pneumothorax biomarker,No diagnostic accuracy data; not a viable pneumothorax biomarker,No diagnostic accuracy data; not a viable pneumothorax biomarker,No diagnostic accuracy data; not a viable pneumothorax biomarker
Acute Heart Failure,"Felker 2015, Eur J Heart Fail 17(9):949; chronic myocyte damage","Zorlu 2012, J Thromb Thrombolysis 33(2):159; stasis",Maisel 2002 [NEJM]; BNP Breathing Not Properly Study,"Windram 2007, Am Heart J 153(2):196; CRP in HF (prognostic, not diagnostic)",Demissei 2017; Peacock 2011; stress & fluid overload,"Niizeki 2007, J Card Fail 13(7):549; H-FABP in HF",No diagnostic accuracy data; not a viable acute HF biomarker,No diagnostic accuracy data; not a viable acute HF biomarker
